{
  "metadata": {
    "artifact_type": "run_config",
    "schema_version": "1.0.0",
    "run_id": "r20260920-170548-50d4",
    "stage": "stage0",
    "created_at": "2026-09-20T17:05:48.414+00:00",
    "tool_version": "carverflow 0.1.0",
    "upstream_refs": []
  },
  "app_profile": {
    "base_url": "http://127.0.0.1:18093",
    "auth": {
      "method": "none",
      "token_scheme": "Token"
    },
    "reset": {
      "command": [
        ".venv/bin/python",
        "-m",
        "subject_adapters.docker_single_local",
        "reset",
        "--adapter",
        "fixtures/adapters/ghost_current_local.json",
        "--output",
        "unused.json"
      ],
      "verify_request": {
        "method": "GET",
        "path": "/ghost/api/admin/site/",
        "expect_status": 200,
        "expect_json_path": "$.site.version",
        "expect_json_equals": "5.130"
      }
    },
    "rate_limit": {
      "max_concurrency": 1,
      "min_interval_ms": 50,
      "retry_on_429": {
        "max_retries": 1
      }
    },
    "drive_mode": "replay",
    "actors": [
      {
        "actor_id": "actor_a",
        "auth": {
          "method": "cookie_session",
          "credentials_ref": {
            "email_env": "UISEMTEST_GHOST_ACTOR_A_EMAIL",
            "password_env": "UISEMTEST_GHOST_ACTOR_A_PASSWORD"
          },
          "token_scheme": "Token",
          "probe_endpoint": {
            "method": "GET",
            "path": "/ghost/api/admin/users/me/",
            "expect_status": 200,
            "unauthenticated_status": 403,
            "expect_json_path": "$.users[0].email"
          },
          "logout_endpoint": {
            "method": "DELETE",
            "path": "/ghost/api/admin/session/"
          },
          "cookie_session": {
            "method": "POST",
            "path": "/ghost/api/admin/session/",
            "headers": {
              "Content-Type": "application/json"
            },
            "body_template": {
              "username": "${email}",
              "password": "${password}"
            },
            "cookie_path": "/ghost"
          }
        }
      },
      {
        "actor_id": "actor_b",
        "auth": {
          "method": "cookie_session",
          "credentials_ref": {
            "email_env": "UISEMTEST_GHOST_ACTOR_B_EMAIL",
            "password_env": "UISEMTEST_GHOST_ACTOR_B_PASSWORD"
          },
          "token_scheme": "Token",
          "probe_endpoint": {
            "method": "GET",
            "path": "/ghost/api/admin/users/me/",
            "expect_status": 200,
            "unauthenticated_status": 403,
            "expect_json_path": "$.users[0].email"
          },
          "logout_endpoint": {
            "method": "DELETE",
            "path": "/ghost/api/admin/session/"
          },
          "cookie_session": {
            "method": "POST",
            "path": "/ghost/api/admin/session/",
            "headers": {
              "Content-Type": "application/json"
            },
            "body_template": {
              "username": "${email}",
              "password": "${password}"
            },
            "cookie_path": "/ghost"
          }
        }
      }
    ]
  },
  "auth_context": {
    "verified": true,
    "method": "cookie_session",
    "auth_mode": "auto_login",
    "actor_id": "actor_a",
    "probe_status": 200,
    "verified_at": "2026-09-20T17:05:47.977+00:00",
    "probe_identity_observed": true,
    "session_ref": "actor_a"
  },
  "rate_limit": {
    "max_concurrency": 1,
    "min_interval_ms": 50,
    "retry_on_429": {
      "max_retries": 1
    }
  },
  "drive_mode": "replay"
}
