{
  "metadata": {
    "artifact_type": "run_config",
    "schema_version": "1.0.0",
    "run_id": "r20260906-142014-f990",
    "stage": "stage0",
    "created_at": "2026-09-06T14:20:14.347+00:00",
    "tool_version": "carverflow 0.1.0",
    "upstream_refs": []
  },
  "app_profile": {
    "base_url": "http://127.0.0.1:3001",
    "auth": {
      "method": "none",
      "token_scheme": "Token"
    },
    "reset": {
      "command": [
        ".venv/bin/python",
        "-m",
        "subject_adapters.conduit_local",
        "reset",
        "--output",
        "unused.json"
      ],
      "verify_request": {
        "method": "GET",
        "path": "/api/articles?limit=1&offset=0",
        "expect_status": 200,
        "expect_json_path": "$.articlesCount",
        "expect_json_equals": 0
      }
    },
    "rate_limit": {
      "max_concurrency": 1,
      "min_interval_ms": 50,
      "retry_on_429": {
        "max_retries": 1
      }
    },
    "drive_mode": "replay",
    "actors": [
      {
        "actor_id": "actor_a",
        "auth": {
          "method": "form_login",
          "login_entry": "/#/login",
          "credentials_ref": {
            "email_env": "UISEMTEST_CONDUIT_ACTOR_A_EMAIL",
            "password_env": "UISEMTEST_CONDUIT_ACTOR_A_PASSWORD"
          },
          "token_scheme": "Token",
          "probe_endpoint": {
            "method": "GET",
            "path": "/api/user",
            "expect_status": 200,
            "unauthenticated_status": 401,
            "expect_json_path": "$.user.username"
          },
          "api_token": {
            "method": "POST",
            "path": "/api/users/login",
            "headers": {
              "Content-Type": "application/json"
            },
            "body_template": {
              "user": {
                "email": "${email}",
                "password": "${password}"
              }
            },
            "token_json_path": "$.user.token"
          }
        }
      },
      {
        "actor_id": "actor_b",
        "auth": {
          "method": "form_login",
          "login_entry": "/#/login",
          "credentials_ref": {
            "email_env": "UISEMTEST_CONDUIT_ACTOR_B_EMAIL",
            "password_env": "UISEMTEST_CONDUIT_ACTOR_B_PASSWORD"
          },
          "token_scheme": "Token",
          "probe_endpoint": {
            "method": "GET",
            "path": "/api/user",
            "expect_status": 200,
            "unauthenticated_status": 401,
            "expect_json_path": "$.user.username"
          },
          "api_token": {
            "method": "POST",
            "path": "/api/users/login",
            "headers": {
              "Content-Type": "application/json"
            },
            "body_template": {
              "user": {
                "email": "${email}",
                "password": "${password}"
              }
            },
            "token_json_path": "$.user.token"
          }
        }
      }
    ]
  },
  "auth_context": {
    "verified": true,
    "method": "form_login",
    "auth_mode": "auto_login",
    "actor_id": "actor_b",
    "probe_status": 200,
    "verified_at": "2026-09-06T14:20:14.282+00:00",
    "probe_identity_observed": true,
    "session_ref": "actor_b",
    "actor_identity_distinct": true,
    "identity_relations_verified": true,
    "identity_relations": [
      {
        "left_actor_id": "actor_a",
        "right_actor_id": "actor_b",
        "left_session_ref": "actor_a",
        "right_session_ref": "actor_b",
        "principal_relation": "different",
        "session_relation": "different",
        "verification_source": "authenticated_probe",
        "verified": true
      }
    ]
  },
  "rate_limit": {
    "max_concurrency": 1,
    "min_interval_ms": 50,
    "retry_on_429": {
      "max_retries": 1
    }
  },
  "drive_mode": "replay"
}
